{
  "schema": "calimocho-engine-index-trust/1",
  "description": "TEST ONLY. Public RFC 8032 keys; never ship.",
  "keys": [
    {
      "keyid": "21fe31dfa154a261626bf854046fd2271b7bed4b6abe45aa58877ef47f9721b9",
      "public_key": "11qYAYKxCrfVS/7TyWQHOg7hcvPapiMlrwIaaPcHURo=",
      "epoch": 1,
      "status": "active",
      "created": "2026-10-26"
    }
  ],
  "revoked_keyids": [
    "39f713d0a644253f04529421b9f51b9b08979d08295959c4f3990ee617f5139f"
  ],
  "floor": {
    "epoch": 1,
    "index_version": 1
  },
  "revoked_engines": []
}
